{
  "schemaVersion": 1,
  "kind": "ai-frontend-assembler-project-state",
  "storage": "project-external",
  "packageDirectory": "ai-baseline-kit",
  "packageVersion": "0.17.0",
  "createdAt": "2026-08-11T04:03:11.775Z",
  "updatedAt": "2026-08-11T08:53:01.406Z",
  "mode": "package-repository-reference",
  "files": {
    "projectScheme": ".ai-frontend-assembler/project-scheme.yml",
    "legacyBaseline": ".ai-frontend-assembler/legacy-baseline.json",
    "adapters": ".ai-frontend-assembler/adapters"
  },
  "upgrade": {
    "strategy": "replace-package-directory",
    "packageStateSeparated": true
  }
}
